0	0	0	1726	Foshee, Vangie A.; Benefield, Thad; Dixon, Kimberly S.; Chang, Ling-Yin; Senkomago, Virginia; Ennett, Susan T.; Moracco, Kathryn E.; Michael Bowling, J.	The effects of moms and teens for safe dates: a dating abuse prevention program for adolescents exposed to domestic violence	Journal of Youth and Adolescence	3 Fokus; 3.2 Kinderschutz und Gewaltprävention; 5 Adressat_innen; 5.2 Jugendliche; 5.3 Eltern und Familie; 6 Gewalt; 6.1 Täter*in; 6.1.1 Peer; 6.2 Art; 6.2.4 Übergriff; 8 Forschung; 8.4 Ergebnisse	Eltern // parents; Gewalt in Beziehungen // dating violence; häusliche Gewalt // domestic violence; Jugend // youth; Prävention // prevention; Wirksamkeit // effectiveness
0	0	0	1727	van Oosten, Johanna M. F.; Peter, Jochen; Boot, Inge	Exploring associations between exposure to sexy online self-presentations and adolescents' sexual attitudes and behavior	Journal of Youth and Adolescence	1 Sozialer Kontext; 1.3 Medien und Technologie; 1.4 Identitäten; 1.4.1 Gender; 5 Adressat_innen; 5.2 Jugendliche; 7 Sexualität; 7.2 Selbstbestimmung; 7.3 Sexuelle Erfahrungen	Einstellungen // attitudes; Internet; Jugend // youth; Risiko // risk; sexuelles Verhalten // sexual behaviour; Sozialisation // socialization
0	0	0	1728	Wright, Michelle F.	Cyber aggression within adolescents' romantic relationships: linkages to parental and partner attachment	Journal of Youth and Adolescence	1 Sozialer Kontext; 1.3 Medien und Technologie; 5 Adressat_innen; 5.2 Jugendliche; 6 Gewalt; 6.1 Täter*in; 6.1.1 Peer; 6.2 Art; 6.2.4 Übergriff; 7 Sexualität; 7.1 Beziehungsgestaltung	Eltern // parents; Familie // family; Gewalt in Beziehungen // dating violence; Internet; Jugend // youth
0	0	0	1729	Sipsma, Heather L.; Ickovics, Jeannette R.; Lin, Haiqun; Kershaw, Trace S.	The impact of future expectations on adolescent sexual risk behavior	Journal of Youth and Adolescence	5 Adressat_innen; 5.2 Jugendliche; 7 Sexualität; 7.3 Sexuelle Erfahrungen	Drogenkonsum // substance consumption; Jugend // youth; Nordamerika // North America; Risiko // risk; sexuelles Verhalten // sexual behaviour; Verhütung // contraception
0	0	0	1730	Martin-Storey, Alexa	Prevalence of dating violence among sexual minority youth: variation across gender, sexual minority identity and gender of sexual partners	Journal of Youth and Adolescence	1 Sozialer Kontext; 1.4 Identitäten; 1.4.1 Gender; 1.4.2 LGBT; 3 Fokus; 3.2 Kinderschutz und Gewaltprävention; 5 Adressat_innen; 5.2 Jugendliche; 6 Gewalt; 6.1 Täter*in; 6.1.1 Peer; 6.2 Art; 6.2.4 Übergriff; 6.3 Negative Folgen; 7 Sexualität; 7.1 Beziehungsgestaltung; 7.3 Sexuelle Erfahrungen; 8 Forschung; 8.4 Ergebnisse	Gewalt in Beziehungen // dating violence; Jugend // youth; Risikoverhalten // risk behaviour; sexuelle Minderheit // sexual minority; Vulnerabilität // vulnerability
0	0	0	1731	Houser, John J.; Mayeux, Lara; Cross, Cassandra	Peer status and aggression as predictors of dating popularity in adolescence	Journal of Youth and Adolescence	3 Fokus; 3.2 Kinderschutz und Gewaltprävention; 5 Adressat_innen; 5.2 Jugendliche; 6 Gewalt; 6.2 Art; 6.2.4 Übergriff; 7 Sexualität; 7.1 Beziehungsgestaltung; 8 Forschung; 8.4 Ergebnisse; 8.5 Forschungslücken	Aggression; Liebesbeziehung // romantic relationship; Peers
0	0	0	1732	Chang, Ling-Yin; Foshee, Vangie A.; Reyes, Heathe Luz McNaughton; Ennett, Susan T.; Halpern, Carolyn T.	Direct and indirect effects of neighborhood characteristics on the perpetration of dating violence across adolescence	Journal of Youth and Adolescence	1 Sozialer Kontext; 1.4 Identitäten; 1.4.3 Schicht; 3 Fokus; 3.2 Kinderschutz und Gewaltprävention; 5 Adressat_innen; 5.2 Jugendliche; 6 Gewalt; 6.1 Täter*in; 6.1.1 Peer; 8 Forschung; 8.4 Ergebnisse; 8.5 Forschungslücken	Gewalt in Beziehungen // dating violence; Jugend // youth; Soziale Schicht // social class
0	0	0	1733	Dank, Meredith; Lachman, Pamela; Zweig, Janine M.; Yahner, Jennifer	Dating violence experiences of lesbian, gay, bisexual, and transgender youth	Journal of Youth and Adolescence	1 Sozialer Kontext; 1.4 Identitäten; 1.4.1 Gender; 1.4.2 LGBT; 5 Adressat_innen; 5.2 Jugendliche; 6 Gewalt; 6.1 Täter*in; 6.1.1 Peer; 6.2 Art; 6.2.4 Übergriff; 7 Sexualität; 7.1 Beziehungsgestaltung; 8 Forschung; 8.4 Ergebnisse	Bisexualität // bisexuality; Gewalt in Beziehungen // dating violence; Jugend // youth; lesbisch // lesbian; schwul // gay; trans*ident // trans*
0	0	0	1734	Updegraff, Kimberly A.; McHale, Susan M.; Zeiders, Katharine H.; Umaña-Taylor, Adriana J.; Perez-Brena, Norma J.; Wheeler, Lorey A.; Rodríguez De Jesús, Sue A.	Mexican-American adolescents' gender role attitude development: the role of adolescents' gender and nativity and parents' gender role attitudes	Journal of Youth and Adolescence	1 Sozialer Kontext; 1.4 Identitäten; 1.4.1 Gender; 1.4.4 Ethnizität; 5 Adressat_innen; 5.2 Jugendliche; 5.3 Eltern und Familie	Eltern // parents; Familie // family; Geschlechterrolle // gender role; Jugend // youth; Lateinamerika // Latin America; Nordamerika // North America; Sozialisation // socialization
0	0	0	1735	Dermody, Sarah S.; Marshal, Michael P.; Cheong, Jeewon; Burton, Chad; Hughes, Tonda; Aranda, Frances; Friedman, Mark S.	Longitudinal disparities of hazardous drinking between sexual minority and heterosexual individuals from adolescence to young adulthood	Journal of Youth and Adolescence	1 Sozialer Kontext; 1.4 Identitäten; 1.4.2 LGBT; 5 Adressat_innen; 5.2 Jugendliche; 8 Forschung; 8.4 Ergebnisse	Bisexualität // bisexuality; Drogenkonsum // substance consumption; lesbisch // lesbian; schwul // gay; sexuelle Minderheit // sexual minority
0	0	0	1736	Ferguson, Christopher J.; Muñoz, Mónica E.; Garza, Adolfo; Galindo, Mariza	Concurrent and prospective analyses of peer, television and social media influences on body dissatisfaction, eating disorder symptoms and life satisfaction in adolescent girls	Journal of Youth and Adolescence	1 Sozialer Kontext; 1.2 Diskurse; 1.3 Medien und Technologie; 1.4 Identitäten; 1.4.1 Gender; 5 Adressat_innen; 5.2 Jugendliche; 8 Forschung; 8.4 Ergebnisse	Jugend // youth; Körper // body; Mädchen // girls; Medien // media; Peers
0	0	0	1737	Bauermeister, José A.	How statewide LGB policies go from ‘‘under our skin’’ to ‘‘into our hearts’’	Journal of Youth and Adolescence	1 Sozialer Kontext; 1.1 Policies; 1.4 Identitäten; 1.4.2 LGBT; 5 Adressat_innen; 5.3 Eltern und Familie; 7 Sexualität; 7.2 Selbstbestimmung	Bisexualität // bisexuality; Eltern // parents; Männer // men; Mentale Gesundheit // mental health; Politik // politics; schwul // gay; sexuelle Minderheit // sexual minority
0	0	0	1738	Bowker, Julie C.; Etkin, Rebecca G.	Does humor explain why relationally aggressive adolescents are popular?	Journal of Youth and Adolescence	3 Fokus; 3.2 Kinderschutz und Gewaltprävention; 5 Adressat_innen; 5.2 Jugendliche; 6 Gewalt; 6.1 Täter*in; 6.1.1 Peer; 7 Sexualität; 7.1 Beziehungsgestaltung	Aggression; Gewalt in Beziehungen // dating violence; Jugend // youth; Peers
0	0	0	1739	Verhoef, Melissa; van den Eijnden, Regina J. J. M.; Koning, Ina M.; Vollebergh, Wilma A. M.	Age at menarche and adolescent alcohol use	Journal of Youth and Adolescence	1 Sozialer Kontext; 1.4 Identitäten; 1.4.1 Gender; 5 Adressat_innen; 5.2 Jugendliche; 7 Sexualität; 7.3 Sexuelle Erfahrungen	Drogenkonsum // substance consumption; Mädchen // girls; Pubertät // Puberty; Risiko // risk
0	0	0	1740	Carlson, Daniel L.; McNulty, Thomas L.; Bellair, Paul E.; Watts, Stephen	Neighborhoods and racial/ethnic disparities in adolescent sexual risk behavior	Journal of Youth and Adolescence	1 Sozialer Kontext; 1.4 Identitäten; 1.4.4 Ethnizität; 5 Adressat_innen; 5.2 Jugendliche; 7 Sexualität; 7.3 Sexuelle Erfahrungen; 8 Forschung; 8.4 Ergebnisse	erstes Mal // sexual debut; Ethnizität // ethnicity; Jugend // youth; Risikoverhalten // risk behaviour; sexuelles Verhalten // sexual behaviour
0	0	0	1741	Schalet, Amy T.; Santelli, John S.; Russell, Stephen T.; Halpern, Carolyn T.; Miller, Sarah A.; Pickering, Sarah S.; Goldberg, Shoshana K.; Hoenig, Jennifer M.	Invited commentary	Journal of Youth and Adolescence	1 Sozialer Kontext; 1.1 Policies; 1.2 Diskurse; 2 Institutioneller Kontext; 2.1 Dynamiken; 3 Fokus; 3.1 Sexualpädagogik	Nordamerika // North America; Policies; Sexualerziehung // sex ed; Sexuelle Abstinenz // abstinence; Sexuelle Bildung // sexuality education; Verhütung // contraception
0	0	0	1742	Lansford, Jennifer E.; Dodge, Kenneth A.; Fontaine, Reid Griffith; Bates, John E.; Pettit, Gregory S.	Peer rejection, affiliation with deviant peers, delinquency, and risky sexual behavior	Journal of Youth and Adolescence	5 Adressat_innen; 5.2 Jugendliche; 7 Sexualität; 8 Forschung; 8.3 Methodologie; 8.4 Ergebnisse	Jugend // youth; Peers; Risikoverhalten // risk behaviour; sexuelles Verhalten // sexual behaviour
0	0	0	1743	Collier, Kate L.; Bos, Henny M. W.; Sandfort, Theo G. M.	Homophobic name-calling among secondary school students and its implications for mental health	Journal of Youth and Adolescence	1 Sozialer Kontext; 1.4 Identitäten; 1.4.1 Gender; 1.4.2 LGBT; 2 Institutioneller Kontext; 2.1 Dynamiken; 2.2 Einrichtungstypen; 2.2.3 Weiterführende Schule; 5 Adressat_innen; 5.2 Jugendliche; 6 Gewalt; 6.1 Täter*in; 6.1.1 Peer; 6.2 Art; 6.2.1 Belästigung; 8 Forschung; 8.4 Ergebnisse	Homofeindlichkeit // homophobia; Jugend // youth; Mentale Gesundheit // mental health; Mobbing // bullying; Schule // school; Schüler*innen // pupils
0	0	0	1744	Pearson, Jennifer; Wilkinson, Lindsey	Family relationships and adolescent well-being: are families equally protective for same-sex attracted youth?	Journal of Youth and Adolescence	1 Sozialer Kontext; 1.4 Identitäten; 1.4.2 LGBT; 5 Adressat_innen; 5.2 Jugendliche; 5.3 Eltern und Familie; 6 Gewalt; 6.2 Art; 6.2.5 Diskriminierung; 7 Sexualität; 7.1 Beziehungsgestaltung; 7.2 Selbstbestimmung	Familie // family; sexuelle Minderheit // sexual minority
0	0	0	1745	Ellis, Wendy E.; Chung-Hall, Janet; Dumas, Tara M.	The role of peer group aggression in predicting adolescent dating violence and relationship quality	Journal of Youth and Adolescence	3 Fokus; 3.2 Kinderschutz und Gewaltprävention; 5 Adressat_innen; 5.2 Jugendliche; 6 Gewalt; 6.1 Täter*in; 6.1.1 Peer; 7 Sexualität; 7.1 Beziehungsgestaltung; 8 Forschung; 8.4 Ergebnisse	Aggression; Beziehungsgestaltung // relationships; Gewalt in Beziehungen // dating violence; Peers
0	0	0	1746	Schnurr, Melissa P.; Lohman, Brenda J.	The impact of collective efficacy on risks for adolescents' perpetration of dating violence	Journal of Youth and Adolescence	1 Sozialer Kontext; 1.4 Identitäten; 1.4.1 Gender; 1.4.3 Schicht; 1.4.4 Ethnizität; 5 Adressat_innen; 5.2 Jugendliche; 6 Gewalt; 6.1 Täter*in; 6.1.1 Peer; 6.2 Art; 6.2.4 Übergriff; 7 Sexualität; 7.1 Beziehungsgestaltung	Drogenkonsum // substance consumption; Gewalt in Beziehungen // dating violence; Jugend // youth; Nordamerika // North America; Risikofaktoren // risk factors; Risikoverhalten // risk behaviour; Soziale Schicht // social class; Sozialisation // socialization
0	0	0	1747	Makin-Byrd, Kerry; Bierman, Karen L.	Individual and family predictors of the perpetration of dating violence and victimization in late adolescence	Journal of Youth and Adolescence	3 Fokus; 3.2 Kinderschutz und Gewaltprävention; 5 Adressat_innen; 5.2 Jugendliche; 5.3 Eltern und Familie; 6 Gewalt; 6.1 Täter*in; 6.1.1 Peer; 6.2 Art; 6.2.4 Übergriff; 7 Sexualität; 7.3 Sexuelle Erfahrungen; 8 Forschung; 8.3 Methodologie; 8.4 Ergebnisse	Familie // family; Gewalt in Beziehungen // dating violence; Jugend // youth
0	0	0	1748	Orpinas, Pamela; Hsieh, Hsien-Lin; Song, Xiao; Holland, Kristin; Nahapetyan, Lusine	Trajectories of physical dating violence from middle to high school: association with relationship quality and acceptability of aggression	Journal of Youth and Adolescence	1 Sozialer Kontext; 1.4 Identitäten; 1.4.4 Ethnizität; 5 Adressat_innen; 5.2 Jugendliche; 6 Gewalt; 6.1 Täter*in; 6.1.1 Peer; 6.2 Art; 6.2.4 Übergriff; 7 Sexualität; 7.1 Beziehungsgestaltung	Gewalt in Beziehungen // dating violence; Jugend // youth; Nordamerika // North America; Schüler*innen // pupils; sexuelle Gewalt // sexual violence
0	0	0	1749	Brooks-Russell, Ashley; Foshee, Vangie A.; Ennett, Susan T.	Predictors of latent trajectory classes of physical dating violence victimization	Journal of Youth and Adolescence	1 Sozialer Kontext; 1.4 Identitäten; 1.4.1 Gender; 3 Fokus; 3.2 Kinderschutz und Gewaltprävention; 5 Adressat_innen; 5.2 Jugendliche; 6 Gewalt; 6.1 Täter*in; 6.1.1 Peer; 8 Forschung; 8.2 Theorie; 8.3 Methodologie; 8.4 Ergebnisse	Gewalt in Beziehungen // dating violence; Jugend // youth; Vulnerabilität // vulnerability
0	0	0	1750	Miller, Shari; Williams, Jason; Cutbush, Stacey; Gibbs, Deborah; Clinton-Sherrod, Monique; Jones, Sarah	Dating violence, bullying, and sexual harassment: longitudinal profiles and transitions over time	Journal of Youth and Adolescence	3 Fokus; 3.2 Kinderschutz und Gewaltprävention; 5 Adressat_innen; 5.2 Jugendliche; 6 Gewalt; 6.1 Täter*in; 6.1.1 Peer; 6.2 Art; 6.2.1 Belästigung; 6.2.4 Übergriff; 7 Sexualität; 7.1 Beziehungsgestaltung; 7.3 Sexuelle Erfahrungen; 8 Forschung; 8.4 Ergebnisse	Gewalt in Beziehungen // dating violence; Jugend // youth; Mobbing // bullying; sexuelle Belästigung // sexual harassment
0	0	0	1751	Zweig, Janine M.; Dank, Meredith; Yahner, Jennifer; Lachman, Pamela	The rate of cyber dating abuse among teens and how it relates to other forms of teen dating violence	Journal of Youth and Adolescence	1 Sozialer Kontext; 1.3 Medien und Technologie; 5 Adressat_innen; 5.2 Jugendliche; 6 Gewalt; 6.1 Täter*in; 6.1.1 Peer; 6.2 Art; 6.2.4 Übergriff; 7 Sexualität; 7.1 Beziehungsgestaltung	Gewalt in Beziehungen // dating violence; Internet; Jugend // youth; Prävalenz // prevalence
0	0	0	1752	Low, Sabina; Polanin, Joshua R.; Espelage, Dorothy L.	The role of social networks in physical and relational aggression among young adolescents	Journal of Youth and Adolescence	3 Fokus; 3.2 Kinderschutz und Gewaltprävention; 5 Adressat_innen; 5.2 Jugendliche; 6 Gewalt; 6.1 Täter*in; 6.1.1 Peer; 8 Forschung; 8.1 Forschungsethik; 8.4 Ergebnisse	Aggression; Jugend // youth; Peers
0	0	0	1753	Leech, Tamara G. J.; Dias, Janice Johnson	Risky sexual behavior: a race-specific social consequence of obesity	Journal of Youth and Adolescence	5 Adressat_innen; 5.2 Jugendliche; 7 Sexualität; 8 Forschung; 8.4 Ergebnisse	Ethnizität // ethnicity; Gesundheit // health; Jugend // youth; Risikoverhalten // risk behaviour; sexuelles Verhalten // sexual behaviour
0	0	0	1754	Needham, Belinda L.	Sexual attraction and trajectories of mental health and substance use during the transition from adolescence to adulthood	Journal of Youth and Adolescence	1 Sozialer Kontext; 1.4 Identitäten; 1.4.1 Gender; 1.4.2 LGBT; 5 Adressat_innen; 5.2 Jugendliche; 7 Sexualität; 8 Forschung; 8.4 Ergebnisse	Drogenkonsum // substance consumption; Jugend // youth; Mentale Gesundheit // mental health; sexuelle Gesundheit // sexual health; sexuelle Minderheit // sexual minority
0	0	0	1755	Nishina, Adrienne	Microcontextual characteristics of peer victimization experiences and adolescents' daily well-being	Journal of Youth and Adolescence	2 Institutioneller Kontext; 2.2 Einrichtungstypen; 2.2.3 Weiterführende Schule; 3 Fokus; 3.2 Kinderschutz und Gewaltprävention; 5 Adressat_innen; 5.2 Jugendliche; 6 Gewalt; 6.1 Täter*in; 6.1.1 Peer; 6.2 Art; 6.2.4 Übergriff; 6.3 Negative Folgen; 8 Forschung; 8.4 Ergebnisse	Jugend // youth; Mobbing // bullying; Peers; Schule // school
0	0	0	1756	Shandra, Carrie L.; Chowdhury, Afra R.	The first sexual experience among adolescent girls with and without disabilities	Journal of Youth and Adolescence	1 Sozialer Kontext; 1.4 Identitäten; 1.4.6 Behinderungen; 5 Adressat_innen; 5.2 Jugendliche; 7 Sexualität; 7.3 Sexuelle Erfahrungen	Behinderung // disability; erstes Mal // sexual debut; Jugend // youth
0	0	0	1757	Rosario, Margaret; Schrimshaw, Eric W.; Hunter, Joyce	Homelessness among lesbian, gay, and bisexual youth: implications for subsequent internalizing and externalizing symptoms	Journal of Youth and Adolescence	1 Sozialer Kontext; 1.4 Identitäten; 1.4.2 LGBT; 2 Institutioneller Kontext; 2.2 Einrichtungstypen; 2.2.6 Jugendamt; 5 Adressat_innen; 5.2 Jugendliche; 6 Gewalt; 6.2 Art; 6.2.5 Diskriminierung; 6.3 Negative Folgen	Diskriminierung // discrimination; Jugend // youth; Mentale Gesundheit // mental health; Nordamerika // North America; obdachlos // homeless; Risiko // risk; sexuelle Minderheit // sexual minority
0	0	0	1758	Vannier, Sarah A.; O'Sullivan, Lucia F.	Who gives and who gets: why, when, and with whom young people engage in oral sex	Journal of Youth and Adolescence	1 Sozialer Kontext; 1.4 Identitäten; 1.4.1 Gender; 5 Adressat_innen; 5.2 Jugendliche; 7 Sexualität; 7.1 Beziehungsgestaltung; 7.2 Selbstbestimmung; 7.3 Sexuelle Erfahrungen	Geschlechterrolle // gender role; Jugend // youth; sexuelles Verhalten // sexual behaviour
0	0	0	1759	Graaf, Hanneke de; van de Schoot, Rens; Woertman, Liesbeth; Hawk, Skyler T.; Meeus, Wim	Family cohesion and romantic and sexual initiation: a three wave longitudinal study	Journal of Youth and Adolescence	5 Adressat_innen; 5.2 Jugendliche; 5.3 Eltern und Familie; 7 Sexualität; 7.1 Beziehungsgestaltung; 7.2 Selbstbestimmung; 7.3 Sexuelle Erfahrungen; 8 Forschung; 8.4 Ergebnisse	Beziehungsgestaltung // relationships; Familie // family; Jugend // youth; sexuelles Verhalten // sexual behaviour
0	0	0	1760	Shulman, Shmuel; Zlotnik, Aynat; Shachar-Shapira, Lital; Connolly, Jennifer; Bohr, Yvonne	Adolescent daughters' romantic competence: the role of divorce, quality of parenting, and maternal romantic history	Journal of Youth and Adolescence	1 Sozialer Kontext; 1.4 Identitäten; 1.4.1 Gender; 5 Adressat_innen; 5.2 Jugendliche; 5.3 Eltern und Familie; 7 Sexualität; 7.1 Beziehungsgestaltung	Beziehungsgestaltung // relationships; Eltern // parents; Familie // family; Mädchen // girls
0	0	0	1761	Hooghe, Marc; Meeusen, Cecil	Homophobia and the transition to adulthood: a three year panel study among Belgian late adolescents and young adults, 2008-2011	Journal of Youth and Adolescence	1 Sozialer Kontext; 1.2 Diskurse; 1.4 Identitäten; 1.4.1 Gender; 1.4.2 LGBT; 5 Adressat_innen; 5.2 Jugendliche; 8 Forschung; 8.4 Ergebnisse	Geschlechterrolle // gender role; Homofeindlichkeit // homophobia; Jugend // youth; Stereotype // stereotypes
0	0	0	1762	Schwarz, Beate; Stutz, Melanie; Ledermann, Thomas	Perceived interparental conflict and early adolescents' friendships: the role of attachment security and emotion regulation	Journal of Youth and Adolescence	5 Adressat_innen; 5.2 Jugendliche; 5.3 Eltern und Familie; 7 Sexualität; 7.1 Beziehungsgestaltung	Eltern // parents; Familie // family; Freunde // friends; Gefühle // emotions; Jugend // youth
0	0	0	1763	Patrick, Megan E.; Morgan, Nicole; Maggs, Jennifer L.; Lefkowitz, Eva S.	"I got your back": friends' understandings regarding college student spring break behavior	Journal of Youth and Adolescence	5 Adressat_innen; 5.2 Jugendliche; 7 Sexualität; 7.3 Sexuelle Erfahrungen	Drogenkonsum // substance consumption; Nordamerika // North America; Peers; Risiko // risk; sexuelles Verhalten // sexual behaviour; Student*innen // college students
0	0	0	1764	Killoren, Sarah E.; Updegraff, Kimberly A.; Christopher, F. Scott	Family and cultural correlates of Mexican-origin youths' sexual intentions	Journal of Youth and Adolescence	1 Sozialer Kontext; 1.4 Identitäten; 1.4.4 Ethnizität; 3 Fokus; 3.1 Sexualpädagogik; 5 Adressat_innen; 5.2 Jugendliche; 5.3 Eltern und Familie; 7 Sexualität; 8 Forschung; 8.4 Ergebnisse	Eltern // parents; Ethnizität // ethnicity; Familie // family; Jugend // youth; Sexualität // sexuality
0	0	0	1765	Loftus, Jeni; Kelly, Brian C.; Mustillo, Sarah A.	Depressive symptoms among adolescent girls in relationships with older partners: causes and lasting effects?	Journal of Youth and Adolescence	1 Sozialer Kontext; 1.4 Identitäten; 1.4.1 Gender; 5 Adressat_innen; 5.2 Jugendliche; 7 Sexualität; 7.1 Beziehungsgestaltung; 8 Forschung; 8.4 Ergebnisse	Beziehungsgestaltung // relationships; Jugend // youth; Mädchen // girls; Mentale Gesundheit // mental health
0	0	0	1766	Vézina, Johanne; Hébert, Martine; Poulin, François; Lavoie, Francine; Vitaro, Frank; Tremblay, Richard E.	Risky lifestyle as a mediator of the relationship between deviant peer affiliation and dating violence victimization among adolescent girls	Journal of Youth and Adolescence	5 Adressat_innen; 5.2 Jugendliche; 6 Gewalt; 6.1 Täter*in; 6.1.1 Peer; 6.2 Art; 6.2.4 Übergriff; 7 Sexualität; 7.1 Beziehungsgestaltung	Gewalt in Beziehungen // dating violence; Jugend // youth; Nordamerika // North America; Peers; Risiko // risk; Risikoverhalten // risk behaviour
0	0	0	1767	Harden, K. Paige; Mendle, Jane	Adolescent sexual activity and the development of delinquent behavior: the role of relationship context	Journal of Youth and Adolescence	3 Fokus; 3.2 Kinderschutz und Gewaltprävention; 5 Adressat_innen; 5.2 Jugendliche; 7 Sexualität; 7.1 Beziehungsgestaltung; 8 Forschung; 8.3 Methodologie; 8.4 Ergebnisse	Beziehungsgestaltung // relationships; Jugend // youth; sexuelles Verhalten // sexual behaviour
0	0	0	1768	Lopez, Vera; Kopak, Albert; Robillard, Alyssa; Gillmore, Mary Rogers; Holliday, Rhonda C.; Braithwaite, Ronald L.	Pathways to sexual risk taking among female adolescent detainees	Journal of Youth and Adolescence	1 Sozialer Kontext; 1.4 Identitäten; 1.4.1 Gender; 3 Fokus; 3.2 Kinderschutz und Gewaltprävention; 5 Adressat_innen; 5.2 Jugendliche; 6 Gewalt; 6.2 Art; 6.2.2 Missbrauch; 7 Sexualität; 7.3 Sexuelle Erfahrungen; 8 Forschung; 8.4 Ergebnisse	Drogenkonsum // substance consumption; Jugend // youth; Mädchen // girls; Mentale Gesundheit // mental health; Risiko // risk; Risikoverhalten // risk behaviour; sexueller Kindesmissbrauch // child sexual abuse; Verhütung // contraception
0	0	0	1769	Murry, Velma McBride; Berkel, Cady; Chen, Yi-Fu; Brody, Gene H.; Gibbons, Frederick X.; Gerrard, Meg	Intervention induced changes on parenting practices, youth self-pride and sexual norms to reduce HIV-related behaviors among rural African American youths	Journal of Youth and Adolescence	1 Sozialer Kontext; 1.4 Identitäten; 1.4.4 Ethnizität; 5 Adressat_innen; 5.2 Jugendliche; 5.3 Eltern und Familie; 7 Sexualität	Eltern // parents; Jugend // youth; Prävention // prevention; Risiko // risk; Sexuell übertragbare Infektionen // sexually transmitted infections; sexuelle Gesundheit // sexual health; sexuelles Verhalten // sexual behaviour
0	0	0	1770	Genna, Natacha M. de; Larkby, Cynthia; Cornelius, Marie D.	Pubertal timing and early sexual intercourse in the offspring of teenage mothers	Journal of Youth and Adolescence	1 Sozialer Kontext; 1.4 Identitäten; 1.4.1 Gender; 3 Fokus; 3.1 Sexualpädagogik; 5 Adressat_innen; 5.2 Jugendliche; 7 Sexualität; 7.3 Sexuelle Erfahrungen; 8 Forschung; 8.4 Ergebnisse	Jugend // youth; Pubertät // Puberty; Schwangerschaft // pregnancy; sexuelles Verhalten // sexual behaviour
0	0	0	1772	Gillmore, Mary Rogers; Chen, Angela Chia-Chen; Haas, Steven A.; Kopak, Albert M.; Robillard, Alyssa G.	Do family and parenting factors in adolescence influence condom use in early adulthood in a multiethnic sample of young adults?	Journal of Youth and Adolescence	3 Fokus; 3.1 Sexualpädagogik; 5 Adressat_innen; 5.2 Jugendliche; 5.3 Eltern und Familie; 7 Sexualität	Familie // family; Jugend // youth; Verhütung // contraception
0	0	0	1773	Graaf, Hanneke de; Vanwesenbeeck, Ine; Woertman, Liesbeth; Keijsers, Loes; Meijer, Suzanne; Meeus, Wim	Parental support and knowledge and adolescents' sexual health: testing two mediational models in a national Dutch sample	Journal of Youth and Adolescence	5 Adressat_innen; 5.2 Jugendliche; 5.3 Eltern und Familie; 7 Sexualität; 8 Forschung; 8.4 Ergebnisse	Eltern // parents; Jugend // youth; sexuelle Gesundheit // sexual health; Verhütung // contraception
0	0	0	1774	Hay, Carter; Meldrum, Ryan	Bullying victimization and adolescent self-harm: testing hypotheses from general strain theory	Journal of Youth and Adolescence	3 Fokus; 3.2 Kinderschutz und Gewaltprävention; 5 Adressat_innen; 5.2 Jugendliche; 6 Gewalt; 6.2 Art; 6.2.4 Übergriff; 6.3 Negative Folgen; 8 Forschung; 8.4 Ergebnisse	Jugend // youth; Mobbing // bullying; Selbstmord // suicide
0	0	0	1775	Casey, Erin A.; Beadnell, Blair	The structure of male adolescent peer networks and risk for intimate partner violence perpetration: findings from a national sample	Journal of Youth and Adolescence	1 Sozialer Kontext; 1.4 Identitäten; 1.4.1 Gender; 3 Fokus; 3.2 Kinderschutz und Gewaltprävention; 5 Adressat_innen; 5.2 Jugendliche; 6 Gewalt; 6.1 Täter*in; 6.1.1 Peer; 7 Sexualität; 7.1 Beziehungsgestaltung; 8 Forschung; 8.4 Ergebnisse	Gewalt in Beziehungen // dating violence; Jugend // youth; jugendliche Täter*innen // adolescent sex offender; Peers
