0	0	1	1286	Siebers, Tobin	A Sexual Culture for Disabled People		1 Sozialer Kontext; 1.2 Diskurse; 1.4 Identitäten; 1.4.6 Behinderungen; 7 Sexualität; 7.2 Selbstbestimmung	Behinderung // disability; Sexualkultur // sexuality culture
0	0	1	1287	Shuttleworth, Russell	Bridging Theory and Experience: A Critical-Interpretative Ethnography of Sexuality and Disability		1 Sozialer Kontext; 1.4 Identitäten; 1.4.6 Behinderungen; 7 Sexualität; 7.2 Selbstbestimmung; 8 Forschung; 8.3 Methodologie; 8.4 Ergebnisse	Behinderung // disability; Ethnographie // ethnography; Sexualität // sexuality; sexuelle Erfahrung // sexual experience
0	0	1	1292	Serlin, David	Touching Histories: Personality, Disability, and Sex in the 1930s		1 Sozialer Kontext; 1.4 Identitäten; 1.4.6 Behinderungen; 7 Sexualität	Behinderung // disability; sexuelle Erfahrung // sexual experience
0	0	0	1303	Saltmarsh, Sue	"The kid most likely"		1 Sozialer Kontext; 1.4 Identitäten; 1.4.1 Gender; 2 Institutioneller Kontext; 2.1 Dynamiken; 2.2 Einrichtungstypen; 2.2.3 Weiterführende Schule; 5 Adressat_innen; 5.2 Jugendliche; 6 Gewalt; 6.1 Täter*in; 6.1.1 Peer; 6.2 Art; 6.2.1 Belästigung	Diskurs // discourse; Mobbing // bullying; Schule // school; Sprache // language
0	0	0	1304	Casella, Ronnie	The Historical and political roots of school violence in South Africa		1 Sozialer Kontext; 1.1 Policies; 2 Institutioneller Kontext; 2.2 Einrichtungstypen; 2.2.3 Weiterführende Schule; 6 Gewalt; 6.2 Art; 8 Forschung; 8.2 Theorie	Gewalt // violence; Politik // politics; Schule // school
0	0	0	1305	Chapman, Amy; Buchanan, Rachel	FYI... Virtual space has a context		1 Sozialer Kontext; 1.3 Medien und Technologie; 1.4 Identitäten; 1.4.1 Gender; 1.4.3 Schicht; 1.4.4 Ethnizität; 5 Adressat_innen; 5.2 Jugendliche; 6 Gewalt; 6.1 Täter*in; 6.1.1 Peer; 6.2 Art; 6.2.1 Belästigung; 8 Forschung; 8.2 Theorie	Aggression; Australien // Australia; Geschlechterrolle // gender role; Internet; Jugend // youth; Literaturreview // literature review; Mobbing // bullying; Peers; Soziale Schicht // social class; Theorie // theory
1	0	1	1306	Robinson, Kerry H.	Sexual harassment in schools		1 Sozialer Kontext; 1.2 Diskurse; 1.4 Identitäten; 1.4.1 Gender; 1.4.2 LGBT; 1.4.3 Schicht; 1.4.4 Ethnizität; 2 Institutioneller Kontext; 2.1 Dynamiken; 2.2 Einrichtungstypen; 2.2.3 Weiterführende Schule; 3 Fokus; 3.2 Kinderschutz und Gewaltprävention; 5 Adressat_innen; 5.2 Jugendliche; 6 Gewalt; 6.1 Täter*in; 6.1.1 Peer; 6.2 Art; 6.2.1 Belästigung	Australien // Australia; Ethnizität // ethnicity; Ethnographie // ethnography; Fokusgruppe // focus group; Homofeindlichkeit // homophobia; Identität // identity; Jugend // youth; Lehrer*innen // Teachers; Männlichkeit // masculinity; Qualitative Interviews; Rassismus // racism; Schule // school; Schüler*innen // pupils; Schulklima // school climate; sexuelle Belästigung // sexual harassment; sexuelle Minderheit // sexual minority; Soziale Schicht // social class; Sozialisation // socialization; Survey; Weiblichkeit // femininity
0	0	0	1311	Carmody, Moira	Young people, ethical sex and violence prevention		1 Sozialer Kontext; 1.2 Diskurse; 1.4 Identitäten; 1.4.1 Gender; 1.4.2 LGBT; 2 Institutioneller Kontext; 2.2 Einrichtungstypen; 2.2.3 Weiterführende Schule; 3 Fokus; 3.2 Kinderschutz und Gewaltprävention; 5 Adressat_innen; 5.2 Jugendliche; 6 Gewalt; 6.2 Art; 6.2.4 Übergriff; 7 Sexualität; 7.1 Beziehungsgestaltung; 7.2 Selbstbestimmung	Australien // Australia; Geschlecht // gender; Gewalt in Beziehungen // dating violence; Jugend // youth; Konsens // consent; Konzept // concept; Liebesbeziehung // romantic relationship; Prävention // prevention; Schule // school; Sexualethik // sexual ethics; sexuelle Gewalt // sexual violence
1	0	0	1312	Robinson, Kerry H.; Davies, Cristyn; Saltmarsh, Sue	Conclusions: Rethinking School Violence		1 Sozialer Kontext; 1.4 Identitäten; 1.4.1 Gender; 2 Institutioneller Kontext; 2.1 Dynamiken; 2.2 Einrichtungstypen; 2.2.3 Weiterführende Schule; 3 Fokus; 3.2 Kinderschutz und Gewaltprävention; 6 Gewalt; 6.2 Art; 6.2.4 Übergriff; 6.5 Disclosure	Geschlecht // gender; Gewalt // violence; Global; Mobbing // bullying; Prävention // prevention; Schüler*innen // pupils; Schulklima // school climate; sexuelle Belästigung // sexual harassment; Theorie // theory
0	0	0	1313	Allen, Louisa; Rasmussen, Mary Louise; Quinlivan, Kathleen	Introduction		1 Sozialer Kontext; 1.2 Diskurse; 3 Fokus; 3.1 Sexualpädagogik; 7 Sexualität; 7.2 Selbstbestimmung; 7.3 Sexuelle Erfahrungen	Sexualerziehung // sex ed; Sexuelle Bildung // sexuality education; Vergnügen // pleasure
0	0	0	1314	McClelland, Sara I.; Fine, Michelle	Over-Sexed and under Surveillance		1 Sozialer Kontext; 1.2 Diskurse; 5 Adressat_innen; 5.2 Jugendliche; 7 Sexualität	Angst // anxiety; Diskurs // discourse; Jugend // youth; Sexualität // sexuality; Sexualkultur // sexuality culture
0	0	0	1315	Hirst, Julia	´Get some Rhythm Round the Clitoris´: Adressing Sexual Pleasure in Sexuality Education in Schools and other Youth Settings		2 Institutioneller Kontext; 2.2 Einrichtungstypen; 2.2.3 Weiterführende Schule; 2.2.7 Kinder- und Jugendhilfe; 2.2.8 Offene Kinder- und Jugendarbeit; 3 Fokus; 3.1 Sexualpädagogik; 5 Adressat_innen; 5.2 Jugendliche; 7 Sexualität	Jugend // youth; Schule // school; Sexuelle Bildung // sexuality education; Vergnügen // pleasure
0	0	0	1316	Ingham, Roger	A Well-Kept Secret: Sex Education, Masturbation, and Public Health		1 Sozialer Kontext; 1.2 Diskurse; 3 Fokus; 3.1 Sexualpädagogik	Diskurs // discourse; Gesundheitswesen // public health; Sexuelle Bildung // sexuality education; Solosexualität // masturbation
0	0	0	1317	Quinlivan, Kathleen	"What´s wrong with Porn?"		1 Sozialer Kontext; 1.2 Diskurse; 1.3 Medien und Technologie; 3 Fokus; 3.1 Sexualpädagogik; 7 Sexualität; 7.3 Sexuelle Erfahrungen	Medien // media; Pornografie // pornography; Sexuelle Bildung // sexuality education; Vergnügen // pleasure
0	0	1	1319	Vincent, Louise; Macleod, Catriona	Introducing a Critical Pedagogy of Sexual and Reproductive Citizenship: Extending the ´Framework of Thick Desire´		1 Sozialer Kontext; 1.2 Diskurse; 3 Fokus; 3.1 Sexualpädagogik; 7 Sexualität; 7.2 Selbstbestimmung; 8 Forschung; 8.2 Theorie	kritische Pädagogik // critical pedagogy
0	0	0	1320	Lamb, Sharon	The Hard Work of Pleasure		1 Sozialer Kontext; 1.2 Diskurse; 3 Fokus; 3.1 Sexualpädagogik	Sexuelle Bildung // sexuality education; Vergnügen // pleasure
0	0	0	1321	Rasmussen, Mary Louise	Pleasure/Desire, Sexularism, and Sexuality Education		1 Sozialer Kontext; 1.2 Diskurse; 1.4 Identitäten; 1.4.1 Gender; 3 Fokus; 3.1 Sexualpädagogik; 7 Sexualität; 7.2 Selbstbestimmung	Sexuelle Bildung // sexuality education; Vergnügen // pleasure
0	0	0	1322	Allen, Louisa	Pleasure´s Perils? Critically Reflecting on Pleasure´s Inclusion in Sexuality Education		1 Sozialer Kontext; 1.2 Diskurse; 3 Fokus; 3.1 Sexualpädagogik; 7 Sexualität; 7.2 Selbstbestimmung; 7.3 Sexuelle Erfahrungen	Sexualerziehung // sex ed; Vergnügen // pleasure
0	0	0	1323	Quinlivan, Kathleen; Allen, Louisa; Rasmussen, Mary Louise	After-Word(s)		1 Sozialer Kontext; 1.2 Diskurse; 3 Fokus; 3.1 Sexualpädagogik; 7 Sexualität; 7.2 Selbstbestimmung; 7.3 Sexuelle Erfahrungen	Sexuelle Bildung // sexuality education; Vergnügen // pleasure
0	0	0	1327	Iverson, Susan V.	A Policy Discourse Analysis of Sexual Assault Policies in Higher Education		1 Sozialer Kontext; 1.2 Diskurse; 2 Institutioneller Kontext; 2.1 Dynamiken; 2.2 Einrichtungstypen; 2.2.5 Hochschule; 3 Fokus; 3.2 Kinderschutz und Gewaltprävention; 6 Gewalt; 6.2 Art; 6.2.4 Übergriff	Policies; Prävention // prevention; Rape Culture; sexuelle Gewalt // sexual violence; Universität // college; Vergewaltigung // rape; Victim-blaming
0	0	0	1329	Marine, Susan	Combating Sexual Violence in the Ivy League: Reflections on Politics, Pain, and Progress		2 Institutioneller Kontext; 2.2 Einrichtungstypen; 2.2.5 Hochschule; 6 Gewalt; 6.2 Art	Politik // politics; Sexuelle Entwicklung // sexual development; sexuelle Gewalt // sexual violence; Universität // college
0	0	0	1330	Crosset, Todd W.	Athletes, Sexual Assault, and Universities' Failure to Address Rape-Prone Subcultures on Campus		2 Institutioneller Kontext; 2.2 Einrichtungstypen; 2.2.5 Hochschule; 3 Fokus; 3.2 Kinderschutz und Gewaltprävention; 6 Gewalt; 6.2 Art; 6.2.3 Vergewaltigung; 6.2.4 Übergriff	Rape Culture; sexuelle Gewalt // sexual violence; Sport // sports; Universität // college; Vergewaltigung // rape
0	0	0	1331	Kiss, Alison; Feeney White, Kiersten N.	Looking Beyond the Numbers: Understanding the Jeanne Clery Act and Sexual Violence		6 Gewalt; 6.2 Art	sexuelle Gewalt // sexual violence; Strafrecht // criminal justice
0	0	0	1334	Thomas-Card, Traci; Eichele, Katie	Comprehensive College- or University-Based Sexual Violence Prevention and Direct Services Program		2 Institutioneller Kontext; 2.2 Einrichtungstypen; 2.2.5 Hochschule; 3 Fokus; 3.2 Kinderschutz und Gewaltprävention; 6 Gewalt; 6.2 Art; 8 Forschung; 8.2 Theorie	Prävention // prevention; sexuelle Gewalt // sexual violence; Universität // college
0	0	0	1335	Henriksen, Caitlin B.; Mattick, Kelsey L.; Fisher, Bonnie S.	Mandatory Bystander Intervention Training: Is the SaVE Act Requirement the "Right" Program to Reduce Violence Among Collge Students?		2 Institutioneller Kontext; 2.2 Einrichtungstypen; 2.2.5 Hochschule; 3 Fokus; 3.2 Kinderschutz und Gewaltprävention	Bystander; Gewalt // violence; Intervention // intervention; Student*innen // college students; Universität // college; Wirksamkeit // effectiveness
0	0	1	1336	Helie, Anissa	Introduction		1 Sozialer Kontext; 1.2 Diskurse; 1.4 Identitäten; 1.4.1 Gender; 1.4.4 Ethnizität; 1.4.5 Religion; 7 Sexualität	Geschlecht // gender; Identität // identity; Interkulturell // intercultural; Islam; Kommentar // commentary; Muslimische Länder // Muslim countries; Religion; Resilienz // resilience; Sexualität // sexuality; Sozialisation // socialization; Widerstand // resistance
1	1	0	1339	Ozyegin, Gul	Gender and sexuality in Muslim cultures		1 Sozialer Kontext; 1.4 Identitäten; 1.4.1 Gender; 1.4.4 Ethnizität; 1.4.5 Religion	Ethnizität // ethnicity; Geschlecht // gender; Islam; Jugend // youth; Männlichkeit // masculinity; Muslimische Länder // Muslim countries; Nähe-Distanz-Regulation // boundary management; Professionalität // professionality; Religion; Sexualität // sexuality; Weiblichkeit // femininity
1	0	0	1341	Wolff, Jennifer M.; Rospenda, Kathleen M.; Colaneri, Anthony S.	Sexual Harassment, Psychological Distress, and Problematic Drinking Behavior Among College Students: An Examination of Reciprocal Causal Relations	The Journal of Sex Research	2 Institutioneller Kontext; 2.2 Einrichtungstypen; 2.2.5 Hochschule; 5 Adressat_innen; 5.2 Jugendliche; 6 Gewalt; 6.2 Art; 6.2.1 Belästigung	Drogenkonsum // substance consumption; sexuelle Belästigung // sexual harassment; Student*innen // college students
1	0	0	1343	Sterzing, Paul R.; Ratliff, G. Allen; Gartner, Rachel E.; McGeough, Briana L.; Johnson, Kelly C.	Social Ecological Correlates of Polyvictimization among a National Sample of Transgender, Genderqueer, and Cisgender Sexual Minority Adolescents	Child Abuse & Neglect	1 Sozialer Kontext; 1.4 Identitäten; 1.4.2 LGBT; 5 Adressat_innen; 5.2 Jugendliche; 6 Gewalt; 6.2 Art; 6.2.5 Diskriminierung; 6.3 Negative Folgen	Jugend // youth; sexuelle Minderheit // sexual minority; trans*ident // trans*
1	0	0	1344	Garland-Levett, Sarah	Exploring discursive barriers to sexual health and social justice in the New Zealand sexuality education curriculum	Sex Education: Sexuality, Society and Learning	1 Sozialer Kontext; 1.2 Diskurse; 1.4 Identitäten; 1.4.2 LGBT; 1.4.4 Ethnizität; 2 Institutioneller Kontext; 2.1 Dynamiken; 2.2 Einrichtungstypen; 2.2.3 Weiterführende Schule; 3 Fokus; 3.1 Sexualpädagogik; 7 Sexualität	Australien // Australia; Curriculum; Diskursanalyse // discourse analysis; Policies; Schule // school; Sexuelle Bildung // sexuality education; sexuelle Gesundheit // sexual health
1	0	0	1345	McKee, Alan	Learning from commercial entertainment producers in order to create entertainment sex education	Sex Education: Sexuality, Society and Learning	1 Sozialer Kontext; 1.3 Medien und Technologie; 3 Fokus; 3.1 Sexualpädagogik	Sexuelle Bildung // sexuality education; Sprache // language
1	0	0	1352	Spišák, Sanna; Paasonen, Susanna	Bad education?	Childhood	1 Sozialer Kontext; 1.2 Diskurse; 5 Adressat_innen; 5.1 Kinder; 7 Sexualität; 7.3 Sexuelle Erfahrungen	Kinder // children; kindliche Sexualität // childhood sexuality; Pornografie // pornography
1	0	0	1353	Boustani, Maya M.; Frazier, Stacy L.; Lesperance, Nephtalie	Sexual health programming for vulnerable youth	Children and Youth Services Review	1 Sozialer Kontext; 1.4 Identitäten; 1.4.3 Schicht; 2 Institutioneller Kontext; 2.2 Einrichtungstypen; 2.2.7 Kinder- und Jugendhilfe; 3 Fokus; 3.1 Sexualpädagogik; 3.2 Kinderschutz und Gewaltprävention; 5 Adressat_innen; 5.2 Jugendliche; 7 Sexualität	Evaluation; Heim // residential care; Jugend // youth; Kinder- und Jugendhilfe // child welfare system; Nordamerika // North America; Prävention // prevention; Risiko // risk; Risikoverhalten // risk behaviour; Schwangerschaft // pregnancy; Sexualerziehung // sex ed; Sexuell übertragbare Infektionen // sexually transmitted infections; sexuelle Gesundheit // sexual health; sexuelles Verhalten // sexual behaviour; Soziale Schicht // social class; soziale Ungleichheit // social inequality; Vulnerabilität // vulnerability
1	0	0	1354	Franklin, Anita; Smeaton, Emilie	Recognising and responding to young people with learning disabilities who experience, or are at risk of, child sexual exploitation in the UK	Children and Youth Services Review	1 Sozialer Kontext; 1.4 Identitäten; 1.4.6 Behinderungen; 3 Fokus; 3.2 Kinderschutz und Gewaltprävention; 4 Fachkräfte; 4.1 Intern; 5 Adressat_innen; 5.1 Kinder; 5.2 Jugendliche; 6 Gewalt; 6.2 Art; 6.2.2 Missbrauch	Behinderung // disability; Europa // Europe; Jugend // youth; Kinder // children; Pädagogische Fachkräfte; Prävention // prevention; Qualitative Interviews; Risikofaktoren // risk factors; Schutz // protection; sexueller Kindesmissbrauch // child sexual abuse
1	0	0	1355	Goldbach, Jeremy T.; Gibbs, Jeremy J.	A developmentally informed adaptation of minority stress for sexual minority adolescents	Journal of Adolescence	1 Sozialer Kontext; 1.4 Identitäten; 1.4.2 LGBT; 5 Adressat_innen; 5.2 Jugendliche; 6 Gewalt; 6.2 Art; 6.2.5 Diskriminierung; 6.3 Negative Folgen; 6.4 Resilienz; 8 Forschung; 8.4 Ergebnisse	Jugend // youth; sexuelle Minderheit // sexual minority
1	0	0	1356	Espinosa-Hernandez, Graciela; Vasilenko, Sara A.; McPherson, Jenna L.; Gutierrez, Estefania; Rodriguez, Andrea	Brief report	Journal of Adolescence	1 Sozialer Kontext; 1.4 Identitäten; 1.4.4 Ethnizität; 5 Adressat_innen; 5.2 Jugendliche; 7 Sexualität	Jugend // youth; Lateinamerika // Latin America; Latinx; Sexualität // sexuality; Survey
1	0	0	1357	Oosten, Johanna M. F. van; Vandenbosch, Laura	Sexy online self-presentation on social network sites and the willingness to engage in sexting: A comparison of gender and age	Journal of Adolescence	1 Sozialer Kontext; 1.3 Medien und Technologie; 5 Adressat_innen; 5.2 Jugendliche	Internet; Jugend // youth; Medien // media; Sexting // sexting
1	0	0	1358	Choi, Hye Jeong; Ouytsel, Joris van; Temple, Jeff R.	Association between sexting and sexual coercion among female adolescents	Journal of Adolescence	1 Sozialer Kontext; 1.3 Medien und Technologie; 1.4 Identitäten; 1.4.1 Gender; 5 Adressat_innen; 5.2 Jugendliche	Jugend // youth; Mädchen // girls; Nordamerika // North America; Risiko // risk; Risikoverhalten // risk behaviour; Sexting // sexting; sexuelle Gewalt // sexual violence; sexuelles Verhalten // sexual behaviour
1	0	0	1359	Weatherred, Jane Long	Framing Child Sexual Abuse	Journal of Child Sexual Abuse	1 Sozialer Kontext; 1.2 Diskurse; 1.3 Medien und Technologie; 2 Institutioneller Kontext; 6 Gewalt; 6.2 Art; 6.2.2 Missbrauch	institutioneller Missbrauch // institutional abuse; Medien // media; sexueller Kindesmissbrauch // child sexual abuse
1	1	0	1360	Anderson, Jane	Socialization Processes and Clergy Offenders	Journal of Child Sexual Abuse	1 Sozialer Kontext; 1.2 Diskurse; 2 Institutioneller Kontext; 2.2 Einrichtungstypen; 2.2.9 Kirche; 6 Gewalt; 6.1 Täter*in; 6.1.2 Erwachsene; 6.2 Art; 6.2.2 Missbrauch; 8 Forschung; 8.2 Theorie	Christentum // christianity; Eltern // parents; Geistliche // clergy; Männlichkeit // masculinity; sexueller Kindesmissbrauch // child sexual abuse; Sozialisation // socialization; Täter*in // offender; Vulnerabilität // vulnerability
1	0	0	1361	Winters, Georgia M.; Kaylor, Leah E.; Jeglic, Elizabeth L.	Sexual offenders contacting children online	Journal of Sexual Aggression	1 Sozialer Kontext; 1.3 Medien und Technologie; 3 Fokus; 3.2 Kinderschutz und Gewaltprävention; 6 Gewalt; 6.1 Täter*in; 6.1.2 Erwachsene; 6.2 Art; 6.2.2 Missbrauch	Grooming; Internet; sexueller Kindesmissbrauch // child sexual abuse
1	0	1	1362	Tomaszewska, Paulina; Krahé, Barbara	Attitudes towards sexual coercion by Polish high school students	Journal of Sexual Aggression	1 Sozialer Kontext; 1.4 Identitäten; 1.4.5 Religion; 5 Adressat_innen; 5.2 Jugendliche; 7 Sexualität; 7.2 Selbstbestimmung	Einstellungen // attitudes; Europa // Europe; Jugend // youth; Pornografie // pornography; Religion; sexuelle Gewalt // sexual violence; sexuelle Skripte // sexual scripts; Survey; Vergewaltigung // rape
1	0	0	1363	Collin-Vézina, Delphine; Garrido, Edward F.	Current issues in child sexual abuse, gender and health outcomes: Shedding new lights to inform worldwide policy and practice	Child Abuse & Neglect	6 Gewalt; 6.2 Art; 6.2.2 Missbrauch; 8 Forschung; 8.4 Ergebnisse	sexueller Kindesmissbrauch // child sexual abuse
1	0	0	1364	Krahé, Barbara; Berger, Anja	Gendered pathways from child sexual abuse to sexual aggression victimization and perpetration in adolescence and young adulthood	Child Abuse & Neglect	5 Adressat_innen; 5.2 Jugendliche; 6 Gewalt; 6.2 Art; 6.2.2 Missbrauch; 6.3 Negative Folgen	Revictimisierung // revictimization; Risikoverhalten // risk behaviour; sexueller Kindesmissbrauch // child sexual abuse; Student*innen // college students
1	0	0	1365	Morris, Matthew C.; Kouros, Chrystyna D.; Janecek, Kim; Freeman, Rachel; Mielock, Alyssa; Garber, Judy	Community-level moderators of a school-based childhood sexual assault prevention program	Child Abuse & Neglect	2 Institutioneller Kontext; 2.2 Einrichtungstypen; 2.2.3 Weiterführende Schule; 3 Fokus; 3.2 Kinderschutz und Gewaltprävention; 6 Gewalt; 6.2 Art; 6.2.1 Belästigung	Kinder // children; Nordamerika // North America; Prävention // prevention; Sicherheit // safety
1	0	0	1370	Schaafsma, Dilana; Kok, Gerjo; Stoffelen, Joke M. T.; Curfs, Leopold M. G.	People with Intellectual Disabilities Talk About Sexuality	Sexuality and Disability	1 Sozialer Kontext; 1.4 Identitäten; 1.4.6 Behinderungen; 3 Fokus; 3.1 Sexualpädagogik; 7 Sexualität; 7.2 Selbstbestimmung	Behinderung // disability; Europa // Europe; Intervention // intervention; Sexualität // sexuality; Sexuelle Bildung // sexuality education; Verhütung // contraception
1	0	0	1371	Frawley, Patsie; Wilson, Nathan J.	Young People with Intellectual Disability Talking About Sexuality Education and Information	Sexuality and Disability	1 Sozialer Kontext; 1.4 Identitäten; 1.4.6 Behinderungen; 3 Fokus; 3.1 Sexualpädagogik; 5 Adressat_innen; 5.2 Jugendliche; 7 Sexualität; 7.2 Selbstbestimmung	Australien // Australia; Behinderung // disability; Fokusgruppe // focus group; Geschlecht // gender; Jugend // youth; Sexuelle Bildung // sexuality education
0	0	0	1373	Sanjakdar, Fida	Living west, facing east		1 Sozialer Kontext; 1.4 Identitäten; 1.4.4 Ethnizität; 1.4.5 Religion; 3 Fokus; 3.1 Sexualpädagogik; 5 Adressat_innen; 5.2 Jugendliche; 7 Sexualität; 7.1 Beziehungsgestaltung; 7.2 Selbstbestimmung; 7.3 Sexuelle Erfahrungen	Islam; Jugend // youth; Nordamerika // North America; Qualitative Interviews; Religion; Sexualerziehung // sex ed; Sexualethik // sexual ethics; Sexualität // sexuality
1	0	0	1375	Mallet, Pascal; Herbe, Dominique	Does knowledge about sexuality prevent adolescents from developing rape-supportive beliefs?	The Journal of Sex Research	1 Sozialer Kontext; 1.2 Diskurse; 3 Fokus; 3.2 Kinderschutz und Gewaltprävention; 5 Adressat_innen; 5.2 Jugendliche; 6 Gewalt; 6.2 Art; 6.2.3 Vergewaltigung; 7 Sexualität; 7.1 Beziehungsgestaltung	Europa // Europe; Jugend // youth; Rape Culture; Sexualität // sexuality; Vergewaltigung // rape
0	0	0	1381	Mir-Hosseini, Ziba	Sexuality and inequality: the marriage contract and Muslim legal tradition		1 Sozialer Kontext; 1.4 Identitäten; 1.4.5 Religion; 7 Sexualität; 7.2 Selbstbestimmung	Heirat // marriage; Islam; Sexualität // sexuality; soziale Ungleichheit // social inequality
0	0	0	1384	Hoodfar, Homa; Ghoreishian, Ana	Morality policing and the public sphere: women reclaiming their bodies and their rights		1 Sozialer Kontext; 1.1 Policies; 1.4 Identitäten; 1.4.1 Gender; 7 Sexualität; 7.2 Selbstbestimmung	Frauen // women; Körper // body; Sexualethik // sexual ethics; sexuelle Rechte // sexual rights
0	0	0	1385	Karim, Shuchi	Living sexualities: non-hetero female sexuality in urban middle-class Bangladesh		1 Sozialer Kontext; 1.4 Identitäten; 1.4.1 Gender; 1.4.2 LGBT; 1.4.4 Ethnizität; 1.4.5 Religion; 7 Sexualität	Bisexualität // bisexuality; Frauen // women; lesbisch // lesbian; Sexualität // sexuality; trans*ident // trans*
0	0	1	1392	Carr, Nicola; Pinkerton, John	Coming into view?		1 Sozialer Kontext; 1.4 Identitäten; 1.4.2 LGBT; 2 Institutioneller Kontext; 2.2 Einrichtungstypen; 2.2.6 Jugendamt; 2.2.7 Kinder- und Jugendhilfe; 5 Adressat_innen; 5.2 Jugendliche	Bisexualität // bisexuality; Jugend // youth; lesbisch // lesbian; schwul // gay; trans*ident // trans*
0	0	1	1393	Winter, Elizabeth A.; Elze, Diane E.; Saltzburg, Susan; Rosenwald, Mitchell	Social services for LGBT young people in the United States		1 Sozialer Kontext; 1.1 Policies; 1.4 Identitäten; 1.4.2 LGBT; 5 Adressat_innen; 5.2 Jugendliche	Bisexualität // bisexuality; Jugend // youth; lesbisch // lesbian; schwul // gay; Sozialisation // socialization; trans*ident // trans*
0	0	0	1399	Saltzburg, Susan	Pedagogy for unpacking heterosexist and cisgender bias in social work education in the United States		1 Sozialer Kontext; 1.4 Identitäten; 1.4.2 LGBT; 2 Institutioneller Kontext; 2.2 Einrichtungstypen; 2.2.5 Hochschule; 4 Fachkräfte; 4.1 Intern	Heteronormativität // heteronormativity; Pädagogik // pedagogy; Pädagogische Fachkräfte; sexuelle Minderheit // sexual minority; Sozialisation // socialization; Student*innen // college students; Universität // college
0	0	0	1400	Pullen Sansfacon, Annie; Manning, Kimberley Ens	Maximising research outcomes for trans children and their families in Canada inquiry		1 Sozialer Kontext; 1.4 Identitäten; 1.4.2 LGBT; 5 Adressat_innen; 5.1 Kinder; 8 Forschung; 8.3 Methodologie	Aktionsforschung // PAR; Eltern // parents; Jugend // youth; Kinder // children; Mentale Gesundheit // mental health; Nordamerika // North America; sexuelle Minderheit // sexual minority; soziale Unterstützung // social support; Sozialisation // socialization; trans*ident // trans*
0	0	0	1405	Lemma, Alessandra; Lynch, Paul E.	Introduction: let´s talk about sex or...maybe not...		3 Fokus; 3.1 Sexualpädagogik	Sexualität // sexuality
0	0	0	1414	Moss, Donald	Sexual aberrations: do we still need the concept? If so, when and why? If not, why not?		1 Sozialer Kontext; 1.2 Diskurse; 7 Sexualität; 8 Forschung; 8.2 Theorie	Diskurs // discourse; sexuelles Verhalten // sexual behaviour
0	0	0	1418	North, Connie E.	Introduction: Bending the Terrain		1 Sozialer Kontext; 1.2 Diskurse; 1.4 Identitäten; 1.4.2 LGBT	Bisexualität // bisexuality; Identität // identity; schwul // gay; Sexuelle Bildung // sexuality education; sexuelle Minderheit // sexual minority; trans*ident // trans*
0	0	0	1421	Fields, Jessica	Differences and Divisions		1 Sozialer Kontext; 1.2 Diskurse; 3 Fokus; 3.1 Sexualpädagogik	Policies; Sexuelle Bildung // sexuality education; soziale Ungleichheit // social inequality
0	0	0	1423	Bailey, Lucy; Graves, Karen	Introduction		1 Sozialer Kontext; 1.2 Diskurse; 1.4 Identitäten; 1.4.2 LGBT; 2 Institutioneller Kontext; 2.1 Dynamiken; 2.2 Einrichtungstypen; 2.2.3 Weiterführende Schule	Gesellschaft // society; Policies; Schule // school; Schulklima // school climate; sexuelle Minderheit // sexual minority; Sozialisation // socialization
0	0	1	1426	Blumenfeld, Warren J.	"We´re Here and We´re Fabolous"		1 Sozialer Kontext; 1.2 Diskurse; 1.4 Identitäten; 1.4.2 LGBT; 5 Adressat_innen; 5.2 Jugendliche	Bisexualität // bisexuality; Homosexualität // homosexuality; Jugend // youth; lesbisch // lesbian; Selbstorganisation // self-organization; trans*ident // trans*
0	0	0	1427	Nunez, Isabel	Introduction		1 Sozialer Kontext; 1.4 Identitäten; 1.4.2 LGBT; 2 Institutioneller Kontext; 2.2 Einrichtungstypen; 2.2.3 Weiterführende Schule; 2.2.5 Hochschule; 4 Fachkräfte; 4.1 Intern	Bisexualität // bisexuality; Identität // identity; Lehrer*innen // Teachers; lesbisch // lesbian; Schule // school; schwul // gay; Sexualität // sexuality; trans*ident // trans*
